id,name,company,published_at,url,salary_from,salary_to,salary_currency,experience,employment,schedule,city,description,key_skills,address,gender_requirement,education_requirement
128863173,Стажер в отдел бухгалтерии (Concession Invoice Processing),Coca-Cola İçecek Kazakhstan  ( ТОО СП «Кока-Кола Алматы Боттлерс» ),2025-12-24T13:44:58+0300,https://hh.ru/vacancy/128863173,,,,Нет опыта,Полная занятость,Полный день,Almaty,"Join us to take your career journey to the next level # ProudlyCCI Job Identification We are looking for an Intern to be a part of our Accounting team located in Almaty, Kazakhstan. What We Expect: Archiving of initial incoming documents. Working with initial incoming documents . Register contracts with partners. Participation in stock counting. Qualifications : University degree in economics/finance/accounting and audit At least one year as an accountant Knowledge Fundamentals of labor, financial and tax law; Principles of accounting / financial accounting and reporting Successfully pass the interview in Company Ethics of business communication Effective communication Presentation skills Conflict Management Critical thinking Teamwork Detail oriented Language skills: Intermediate English level or higher Computer skills: Excel, Word",,"Алматы, улица Гоголя, 203",any,no_requirement
128705169,Growth/Traffic-маркетолог,СЕРВИС ГРУПП,2025-12-24T13:43:22+0300,https://hh.ru/vacancy/128705169,2000.0,6000.0,USD,От 3 до 6 лет,Полная занятость,Удаленная работа,Almaty,"Мы — команда, которая помогает бизнесу и предпринимателям решать ф инансовые, бухгалтерские и юридические задачи. Стабильная компания, профессиональная среда, сложные услуги, которые требуют сильного маркетинга — идеальная площадка для тех, кто любит выводить проекты на новый уровень. Сейчас мы ищем маркетолога , который умеет создавать поток клиентов через социальные сети и управлять трафиком с драйвом и экспертизой. Чем предстоит заниматься: Строить и масштабировать трафик из соцсетей. Разработка креативных рекламных гипотез и их тестирование. Работа с контентом: от идеи до выхода материала. Оптимизация рекламных кампаний: аналитика, A/B тесты, новые подходы. Построение сильной воронки: трафик → внимание → доверие → заявки. Использовать Telegram как основной канал привлечения и прогрева лидов. Соблюдение рекламных требований и точная подача услуг. Что мы предлагаем: Полностью удалённая работа . Работайте из любой точки мира, где вам комфортно думать, создавать и запускать. Комфортный график 5/2, пн-пт Высокий уровень дохода . Совокупный доход от 2000$ в месяц. Рост вместе с компанией. Вы будете работать в нише, где маркетинг реально влияет на поток клиентов, ваши идеи будут заметны, а решения — значимы. Свобода действий . Мы открыты к экспериментам и новым подходам, если вы любите тестировать гипотезы, мы вам подходим. Кого мы ищем: Growth / traffic-маркетолога, а не «классического» маркетолога. Маркетолога, который знает финансовую/юридическую/бухгалтерскую сферу и понимает её нюансы. Специалиста, который умеет работать с трафиком руками и получать измеримый результат. Специалиста с опытом арбитража трафика (финтех, платёжные сервисы, сложные ниши). Это будет огромным плюсом. Человека, который сам строит стратегию и отвечает за цифры. Не рассматриваем специалистов с фокусом на Яндекс.Директ или SEO. Человека, который не боится сложных ниш и понимает, как продвигать профессиональные услуги честно и корректно. Если вы чувствуете, что эта роль — то самое место, где ваши идеи могут выстрелить, а опыт по-настоящему п роявиться, то не откладывайте, оставляйте отклик. Ждём вас в команде , где ценят результат, свободу и профессионализм.",,,any,no_requirement
128572361,Senior CRM Marketing Manager,inDrive,2025-12-24T13:42:41+0300,https://hh.ru/vacancy/128572361,,,,От 3 до 6 лет,Полная занятость,Полный день,Almaty,"We are looking for a Senior Product Marketing Manager to drive activation, engagement, retention, and monetization through multichannel campaigns. You will partner with Product, Data, and ML teams to build AI-driven personalization, run experiments, analyze performance, and manage the global CRM roadmap for measurable business impact. Responsibilities: Own end to end CRM strategy across lifecycle stages to drive activation, engagement, retention, and monetization. Develop, launch, and optimize multi channel communication flows (push, email, in app, SMS, WhatsApp) based on behavioral and predictive signals. Partner with Product, Data, ML, and MarTech teams to design experiments, build new CRM capabilities, and scale AI driven personalization. Analyze performance using LTV, uplift, incrementality, and cohort metrics to identify high impact growth opportunities. Manage CRM roadmap and execution for global markets, ensuring timely delivery, cross team alignment, and measurable business impact. Qualifications: 5 years in CRM/lifecycle marketing in high growth digital products (marketplaces, mobility, delivery, or fintech preferred). Strong expertise in segmentation, messaging logic, experimentation frameworks, and multi channel communication orchestration. Hands on experience with CRM/ESP/CDP platforms (Braze, Bloomreach or similar) and solid understanding of MarTech architecture. Data literacy: SQL or analytical tools proficiency, ability to interpret models, and experience working with predictive/ML based targeting. Demonstrated ability to lead cross functional initiatives, influence stakeholders, and deliver measurable revenue or retention impact. Conditions & Benefits: Health insurance with oncology coverage and life insurance included Hybrid work mode and flexible schedule Relocation package offered for candidates from other regions to Cyprus or Kazakhstan Access to professional counseling services including psychological, financial, and legal support Diverse internal training programs Partially or fully paid additional training courses All necessary work equipment Fitness club membership discount","CRM marketing, Bloomreach",,any,no_requirement
128571881,Руководитель отдела продаж,A & E LAMGROUP,2025-12-24T13:34:26+0300,https://hh.ru/vacancy/128571881,2000000.0,3500000.0,KZT,От 3 до 6 лет,Полная занятость,Полный день,Almaty,"Обязанности: Laminam Kazakhstan - официальный представитель международного бренда Laminam , мирового лидера в производстве крупноформатных керамических плит премиум-класса для архитектуры, интерьеров и мебели. Мы создаём комплексные решения для архитекторов, дизайнеров, мебельных производств и застройщиков, влияя на формирование облика современного Казахстана. Сейчас ищем Руководителя отдела продаж (Алматы) - человека, который возьмёт под управление подразделение, усилит продажи и станет ключевым звеном между коммерческим директором, менеджерами и маркетингом. Что предстоит сделать: Обеспечить выполнение и перевыполнение плана продаж подразделения Алматы. Повысить средний чек , усилив работу менеджеров с потребностями клиентов. Увеличить конверсию в сделку , подключаясь к ключевым этапам переговоров. Обеспечить прозрачность и контроль всех проектов — видеть статусы, динамику и причины успехов/провалов. Усилить эффективность менеджеров , выявив точки роста и улучшив качество продаж. Увеличить количество и качество входящих лидов через системное взаимодействие с маркетингом. Сформировать сильную, мотивированную команду , работающую на результат без жёсткого давления. Кого мы ищем: Человека, способного увеличить продажи подразделения , а не просто наблюдать за процессом. Специалиста, который умеет сам продавать и усиливать продажи команды . Лидера, который способен создать доверительные рабочие отношения Партнёра для менеджеров, который может в нужный момент подключиться и довести сделку до решения . Быстро обучаемого и включённого человека, который сможет принимать решения на основе данных и ситуации . Человека действий, цифр и результатов. ПРЕИМУЩЕСТВЕННО с опытом работы в премиум сегменте Что мы предлагаем: Возможность влиять на результаты продаж в премиальном сегменте архитектуры и дизайна . Работа в международном бренде с сильной репутацией и устойчивым спросом. Поддержка руководства и маркетинга — для достижения быстрых и видимых результатов. Чёткая система мотивации, привязанная к вашим достижениям: Оклад: 200 000 тг KPI от выполнения плана подразделения","Управление командой, Управление продажами, Управление отношениями с клиентами, Прямые продажи, Навыки переговоров, Обучение персонала, Руководство коллективом, Планирование продаж, Аналитика продаж, Анализ продаж, B2B Продажи, B2C продажи","Алматы, проспект Гагарина, 245",any,no_requirement
128865198,Education & Marketing Manager (Beauty Care Professional),Henkel Central Asia & Caucasus,2025-12-24T13:26:47+0300,https://hh.ru/vacancy/128865198,,,,От 3 до 6 лет,Полная занятость,Полный день,Almaty,"Responsibilities: Defines local PPS strategy and education offer, aligned with regional and international PPS strategic priorities, and collaborates with local sales and marketing on integrated initiatives driving market penetration Plans training in context of business priorities and works with sales management to focus on correct commercial approach to SOW/NCA/Launches Proactively maintains understanding of market developments and product innovation Manages, assesses and develops trainer team / freelancers Builds and manages ambassadors in chosen priority countries Promotes a strong commercial approach to educational activities and critically reviews success of launches, promotions and activities to ensure continual improvement of educational support Plans, directs and monitors development of educational materials, ensuring relevance and consistency, including adaptation and translation of international content Defines channel-specific education offer Manages local events, e.g. trade fairs, hairdressing awards or other industry events Responsible for local PPS Budget Requirements: A strong background in marketing, sales, or a related field Proven experience in conducting training and master classes Experience in hairdressing and coloration will be an advantage Languages: English – Upper Intermediate / Advanced; Russian - Advanced Microsoft Office user (PowerPoint and Excel) Outstanding communication skills and a proactive approach on a day-to-day basis. Compensation & benefits: Employment in an international company with well-established corporate values and standards. Annual bonus. Medical insurance. Social package (subsidy for food, payment for mobile services and other benefits in accordance with the rules of the company). At Henkel, we come from a broad range of backgrounds, perspectives, and life experiences. We believe the uniqueness of all our employees is the power in us. Become part of the team and bring your uniqueness to us! We welcome all applications across different races, colors, religions, sexes, national origins, disabilities, veteran statuses, ages, sexual orientations, gender identities and expressions, and other legally protected characteristics.","Позиционирование бренда, Управление ассортиментом, Анализ конкурентной среды, Анализ эффективности маркетинговых кампаний, Событийный маркетинг, Английский язык, Event Management, Training","Алматы, улица Масанчи, 78",any,no_requirement
128134185,"Program Manager, CSS",KIMEP,2025-12-24T13:19:19+0300,https://hh.ru/vacancy/128134185,,,,От 1 года до 3 лет,Полная занятость,Полный день,Almaty,"CVs are acceptable in English only. The College of Social Sciences is looking for applicants for the following position: Job Title: Program Manager Division: College of Social Sciences Position reports to: Dean of CSS/ Associate Dean Job Purpose Summary: Reporting to the Dean of CSS and Associate Dean the holder of this position interacts closely with the department chairs. Main responsibilities include running the academic programs and administratively overseeing the departments hosted at the College of Socials Sciences. The Program Manager will be the one of the main contact person for students and the college community. The Program Manager works directly with the faculty of the college and facilitates their academic work. The Program Manager provides all necessary administrative documents to the Administrative manager of CSS. The Program Manager plans, coordinates, and implements such activities as student outreach, student advising in direct coordination with chairs and faculty, student recruitment, student orientation, oversight and training of student assistants and interns, workshops, student referrals to services, information collection, analysis of students' performance, and other support services necessary for successful program implementation. The job requires excellent skills in organization and planning, in-depth knowledge of academic policies, regulations, rules, and the curricula of the different programs. Key Responsibilities and Duties: Works closely with the department chairs, the dean and the associate dean; Provides the departments' services to ensure that program goals and objectives are achieved; Advises students on academic choices and facilitates implementation (for example, change of program, election of majors and minors, transfer of credits after exchange programs and transfer between institutions); Advises students on study planning taking into account scheduling decisions and program policies of the different departments; Prepares the schedule in cooperation with the dean and the department chairs and uploads the schedule to the registration system; Consults with the dean and the department chairs on changes to courses and programs, course scheduling, and graduation requirements. Checks and verifies degree requirements/majors/minors of graduating students, ensures timely submission of documents related to state examinations and thesis defense (forms, minutes etc), provides all necessary paperwork. Advises on program development in relation to government regulations, Liaises with registrar's office to ensure the accuracy of records; Exchanges information with campus offices and entities, students, and the general public regarding college programs and services and other information; makes presentations as requested; plans and conducts workshops and orientations as requested; coordinates logistics and establishes timelines, required materials, online support services, facilities, publicity and other program needs; Produces brochures and other program related information for publication; Serves as liaison between program participants and various instructional and student services departments; refers students and clients to community, academic and student services, leads and coordinates the work of student assistants, interns and other staff as assigned; Conducts surveys, collects and compiles statistical, financial, academic and other data for regular and special reports to track student profiles and participation, student follow-up, retention and transfer rates, program evaluation criteria, scholarship availability and deadlines, and other information; Helps departmental chairs determine and forecast student needs for courses, class sections etc. for better curriculum development and scheduling; Enters, modifies and retrieves online data; uses a variety of software to compose correspondence, publicity materials, surveys, reports, presentations, and other materials; sets up and maintains confidential and other files; editing, printing, multimedia enhancements, distribution and other services in conjunction with other staff or students; Coordinates the administration of intakes in cooperation with Admission Office; transfer credits for prospective students in collaboration with the dean and the department chairs; liaises with-student services for the purpose of facilitating student success; refers students to career and other counselors, instructional programs and to other college offices as appropriate; Ensures compliance to policy and procedures by reporting progress to relevant entities; Takes over tasks from other administrative staff of CSS as operationally necessary, for instance, share responsibilities for program accreditation, ESUVO, Atameken reporting and other assignments; Regularly updates CSS promotional materials for bachelor, master, and doctoral programs, and maintains CSS web-pages related to academic programs and available doctoral scholarships; Organizes and assists in holding the annual CSS Excellence Scholarship competition; Communicates with graduate students awarded KIMEP scholarships, grants, or stipends regarding any changes to the terms; Performs other related duties as assigned by the dean or administrative manager. Minimum Qualifications: Master's degree in management/administration/education from a recognized university; 3 years experience in education, counseling, research, or other relevant fields; Familiarity with different credit systems of higher education; Leadership and organizational skills; Strong interpersonal communication skills with diverse populations such as staff, students, parents and faculty; Excellent writing and oral communication skills in English, Kazakh and Russian; Experience using spreadsheets, charts and a variety of computer software to format, compose and present statistical data and reports including researching, formatting, assessing and preparing data for reports and other materials; Experience in developing surveys and online reports related to students' statistics, students' retention and scheduling. Creative, strategic and analytical thinking with the ability to manage multiple projects. Good computer skills; Punctual, flexible, customer-oriented Desirable Qualifications: Master's degree in management/administration/education from a Western university or equivalent; Very good knowledge of GOSO, publication regulations, and degree awarding procedures for graduate-level students Previous administrative experience at Higher Education Institution Possession of computational skills Deadline for submission of applications/resumes is December 10, 2025 inclusive or open until filled Please indicate your salary expectations in KZT, net monthly.","Организаторские навыки, Пользователь ПК, Коммуникабельность","Алматы, проспект Абая, 2",any,no_requirement
